,0,1,2,3,4,5
3,209,176,"ДЕДИЛОВ, слобода Тульского Наместничества в Белевском уезде. Здесь бывает ярмарка Июля 5 и 16 чисел; приезжают на оную из ближних городов с мелочными для крестьянства товарами.",Тульскаго Намѣстничества,Бѣлевскомъ уѣздѣ,слобода
264,316,174,"КОЛЮПАНОВКА, село Тульского Наместничества в 7 верстах от Алексина. Здесь бывает ярмарка Июля 8 числа, на которую приезжают купцы из Алексина с мелкими для крестьян товарами.",Тульскаго Намѣстничества,,село
292,251,174,"ИВИЦА , слобода Курского Наместничества в Короченском уезде. В оной бывает в году две ярмарки: первая Июня 29, вторая Июля 20 дня; на оные купцы приезжают с разными товарами.",Курскаго Намѣстничества,Короченскомъ уѣздѣ,слобода
282,76,173,"БУДИЧЬ, местечко Екатеринославского Наместничества в Полотавском уезде. В оном бывает в году, сверх еженедельных торжков, две ярмарки: одна Июля 8, а другая Сентября 26 дня.",Екатеринославскаго Намѣстничества,Полотавскомъ уѣздѣ,мѣстечко
277,580,170,"РОГАЧЕВО , Економическое село Московской Губернии в Дмитровском уезде. В оном ряды имеются и торжке, и бывает в году две ярмарки : первая Мая 9, вторая о десятой пятнице.",Московской Губерніи,Дмитровскомъ уѣздѣ,Економическое село
211,690,170,"ТИХОНОВА, пустыня Орловского Наместничества в Карачевском уезде. Здесь бывает ярмарка Июня 16 дня, на которую привозит разных городов купечество шелковые и прочие товары.",Орловскаго Намѣстничества,Карачевскомъ уѣздѣ,пустыня
55,383,169,"ЛИПЦЫ, слобода в уезде города Харькова. Здесь бывают ярмарки Мая 9, Июня 29, Сентября 1, Декабря 6; торгуют купцы разным мелочным товаром, медом, пивом , вином и прочим.",,Харькова,слобода
179,318,169,"КОМЛИЧКИ , село Киевского Наместничества в Лубенском уезде. В оном бывает в году две ярмарки : одна после Пасхи на Фоминой неделе , другая в день Великомученицы Варвары.",Кіевскаго Намѣстничества,Лубенскомъ уѣздѣ,село
15,34,169,"БАТРАК, село Синбирского Наместничества ниже города Сызрани. В нем с 29 Июня по 12 Июля бывает годовая ярмарка, на которую особливо привозят много уральской рыбы и икры.",Синбирскаго Намѣстничества,,село
156,323,168,"КОПРИНО, село Ярославского Наместничества и уезду. Здесь бывает годовая Сергиевская ярмарка Сентября в 25 день; продают на оной крестьяне масло коровье и прочие товары.",Ярославскаго Намѣстничества,Ярославскаго уѣздѣ,село
18,516,167,"ПЕНЗА, главный город Наместничества сего имени. В нем бывает в году две ярмарки: первая по Пасхе на седьмой неделе в четверг, вторая в день С. Апостолов Петра и Павла.",Пенза Намѣстничества,,главный городъ
215,675,166,"СЯМСКОЙ, монастырь Вологодского Наместничества и уезду. При оном монастыре бывает в году три ярмарки, на которых торгуют Вологодские купцы разными мелочными товарами.",Вологодскаго Намѣстничества,Вологодскаго уѣздѣ,монастырь
87,366,166,"КУРЬЯНОВО , местечко Полотского Наместничества. В сем месте бывает в году одна ярмарка ; торгуют Рижского Дворца крестьяне разными мелочными товарами , вином и пивом.",Полотскаго Намѣстничества,,мѣстечко
79,215,166,"ЕЛИМСКОЙ, погост Псковского Наместничества в уезде города Острова. Здесь бывает ярмарка в Июне месяце; купцы на оную приезжают из Пскова с разными мелочными товарами.",Псковскаго Намѣстничества,Острова,погостъ
207,262,164,"ИСЕТСКАЯ, слобода уфимского Наместничества в уезде города Челябинска. Бывают здесь ярмарки на десятой неделе по Пасхе и Октября 23 дня ; торгуют мелочными товарами.",уфимскаго Намѣстничества,Челябинска,слобода
52,212,164,"ЕКАТЕРИНИНСКАЯ, ХАЛАНЬ тожь, слобода Киевского Наместничества около местечка Яблунева. В оной бывают три в году ярмарки; купцы на оные приезжают с разными товарами.",Кіевскаго Намѣстничества,,слобода
81,461,163,"НАРВА , город С. Петербургской Губернии В нем еще по Шведским учреждениям положено в год быть двум ярмаркам , в Феврале и Июлемесяцах, каждой по четырнадцати дней.",С. Петербургской Губерніи,,городъ
151,192,162,"ДМИТРОВКА, ОЛЬШАНКА тожь , село Киевского Наместничества около слободы Яблунева. Бывает здесь одна годовая ярмарка, на которую купцы приезжают с разными товарами.",Кіевскаго Намѣстничества,,село
198,777,162,"ШАРТОЛИНСКОЙ НИКОЛАЕВСКОЙ , монастырь Володимерского Наместничества в уезде города Шуи. Бывает здесь ярмарка Мая 9; торгуют купцы иностранными лавочными товарами.",Володимерскаго Намѣстничества,Шуи,монастырь
47,759,162,"ЧЕРЕНЧИЦКОЙ, погост в уезде города Старой Рузы. Здесь бывает одна годовая ярмарка в день Ильинской пятницы, и купцы приезжают из Старой Рузы с мелочными товарами.",,Старой,погостъ
284,525,161,"ПЕТРОВКИ , село Екатеринославского Наместничества ь Полтавском уезде. В оном бывает каждонедельной торге окольными жителями разными съестными припасами и питьем.",Екатеринославскаго Намѣстничества,Полтавскомъ уѣздѣ,село
65,423,161,"МЕРЕХВА, местечко Харьковского Наместничества и уезду. Здесь бывают ярмарки Июня 24, Августа 6; торгуют купцы мелочными, товарами , вином, пивом, медом и прочим.",Харьковскаго Намѣстничества,Харьковскаго уѣздѣ,мѣстечко
191,540,160,"ПОВОДНЕВО, село Тверского Наместничества в уезде города Бежецка. Здесь бывает годовая ярмарка 14 Сентября; съезжаются на оную купцы с мелочным лавочным товаром.",Тверскаго Намѣстничества,Бѣжецка,село
14,426,160,"МИЖИРИЧЬ, местечко в Малороссии. В оном бывают ярмарки : первая Мая 9, вторая Июля третия Октября 26. Купцы приезжают из окрестных городов с мелочными товарами.",,,мѣстечко
149,195,159,"ДОМНИЦКОЙ, монастырь Черниговского Наместничества и уезду. При оном. бывает две в году ярмарки: первая после Пасхи в десятую пятницу , а другая Сентября 8 дня.",Черниговскаго Намѣстничества,Черниговскаго уѣздѣ,монастырь
37,287,159,"КИДЕШКИНО , село Костромского Наместничества в уезде города Юрьевца Польского. В нем. кроме еженедельных торжков, в день Бориса и Глеба бывает годовая ярмарка.",Костромскаго Намѣстничества,Юрьевца,село
38,519,159,"ПЕРЕКОПЕЦ , местечко в уезде города Харькова. Здесь бывает ярмарка Марта 9, Мая 6 и Ноября 8, торгуют купцы мелочными товарами, вином , пивом , медом и прочим.",,Харькова,мѣстечко
40,625,158,"СЕРЕГА , слобода Вологодского Наместничества в Яренском уезде. Здесь бывает ярмарка Июня с 23 по 26 ; на оной покупают у промышленников разную мягкую рухлядь.",Вологодскаго Намѣстничества,Яренскомъ уѣздѣ,слобода
74,382,158,"ЛИПОВСКОЕ, село Вологодского Наместничества в Яренском уезде. В оном бывает торговля однажды в год Генваря 19, но по большей части торгует здесь крестьянство.",Вологодскаго Намѣстничества,Яренскомъ уѣздѣ,село
187,21,157,"АРТЕМОНОВКА , слобода Харьковского Наместничества и уезду; здесь бывают ярмарки Июля 8 и Ноября 21, Торгуют купцы мелочными товарами , пивом, медом и прочим.",Харьковскаго Намѣстничества,Харьковскаго уѣздѣ,слобода
226,58,157,"БОГОЯВЛЕНСКАЯ, слобода Владимерского Наместничества в Суздальском уезде. Здесь бывает годовая ярмарка; на оную съезжаются из разных городов купцы с товарами.",Владимерскаго Намѣстничества,Суздальскомъ уѣздѣ,слобода
93,292,156,"КИРИЛОЕО , село Тульского Наместничества в уезде города Новосиля. В оном селе бывает ярмарка Июля 15дня, купцы торгуют разными мелочными лавочными товарами.",Тульскаго Намѣстничества,Новосиля,село
4,651,156,"СПИРОВО, село Московской Губернии в Волоколамском уезде. В сем селе бывает годовая ярмарка Ноября 21 дня ; торгуют один день разными крестьянскими товарами.",Московской Губерніи,Волоколамскомъ уѣздѣ,село
285,434,156,"МИХАЙЛОВКА , местечко Киевского Наместничества око ло местечка же Яблунева. В оном бывает в году пять ярмарок, на которые купцы приезжают с разными товарами",Кіевскаго Намѣстничества,,мѣстечко
107,486,156,"ОКВАДСКАЯ , волость Вологодского Наместничества в уезде города Яренска. Здесь бывает ярмарка Ноября 21 дня; скупают приезжие купцы Зырянскую мягкую рухлядь.",Вологодскаго Намѣстничества,Яренска,волость
131,158,155,"ГНИЛЬСКОЙ, погост Псковского Наместничества в Островском уезде. Здесь бывает ярмарка в Маие месяце; купцы приезжают из Пскова с разными мелочными товарами.",Псковскаго Намѣстничества,Островскомъ уѣздѣ,погостъ
49,24,153,"АСАКОВО , село Тульского Наместничества в Веневском уезде ; здесь бывает годовая ярмарка Июля 8 числа; приезжают на оную разных городов купцы с товарами.",Тульскаго Намѣстничества,Веневскомъ уѣздѣ,село
28,555,153,"ПОЧИНКИ, село Пензенского Наместничества в Саранском уезде. Бывает здесь ярмарка в последних числах Июля; привозят купцы разные мелочные шелковые товары.",Пензенскаго Намѣстничества,Саранскомъ уѣздѣ,село
68,367,153,"ЛАДА , село Рязанского Наместничества в Зарайском уезде. Здесь бывает годовая ярмарка Июля 8 Дня; привозят на оную купцы разные мелочные шелковые товары.",Рязанскаго Намѣстничества,Зарайскомъ уѣздѣ,село
61,166,152,"ГОРОДИЩЕ , местечко Киевского Наместничества в Лубенском уезде. В оном бывает в году три ярмарки : первая Генваря 1, вторая Мая 2, третия Августа 1 дня.",Кіевскаго Намѣстничества,Лубенскомъ уѣздѣ,мѣстечко
117,49,151,"БОБЫЛЕВСКОЕ, село Уфимского Наместничества в Челябинском уезде. Здесь бывает в году ярмарка Генваря 30 и Октября 1. Торгуют разными мелочныии товарами.",Уфимскаго Намѣстничества,Челябинскомъ уѣздѣ,село
253,363,151,"КУНГУР, город Пермского Наместничества. В сем городе во время праздников бывают для торговли съезды Генваря 4, Октября 28 и в девятую пятницу по Пасхе.",Пермскаго Намѣстничества,,городъ
125,206,151,"ДУНИЛОВО, село Владимеркого Наместничества в Суздальском уезде. Здесь бывает ярмарка 1 Октября; приезжают купцы из разных городов с мелочными товарами.",Владимеркаго Намѣстничества,Суздальскомъ уѣздѣ,село
53,285,150,"КЕСМЕ , село Тверского Наместничества в уезде города Бежецка. Здесь бывает одна годовая ярмарка; съезжаются на оную купцы с мелочным лавочным товаром.",Тверскаго Намѣстничества,Бѣжецка,село
136,243,150,"ИВАНОВКА , село Пензенского Наместничества в Саранском уезде. Здесь бывает годовая ярмарка Июля 8 Дня; привозят купцы разные мелочные шелковые товары.",Пензенскаго Намѣстничества,Саранскомъ уѣздѣ,село
205,568,149,"ПУТЯТИНО, село Тамбовского Наместничества около городка Доброго. Здесь бывает в году ярмарка Июля 8, на которую приезжают купцы с мелочными товарами.",Тамбовскаго Намѣстничества,,село
257,265,149,"ИОСИФОВ, монастырь Московской Губернии в Рузском уезде. Подле оного монастыря бывает годовая ярмарка Июля 20 дня; торгуют разными мелочными товарами.",Московской Губерніи,Рузскомъ уѣздѣ,монастырь
309,536,148,"ПИСЦОВО , село Костромского Наместничества и уезду. Здесь бывают годовые ярмарки в девятую и десятую неделю по Пасхе, для которых построены и лавки.",Костромскаго Намѣстничества,Костромскаго уѣздѣ,село
310,4,148,"АВЖЕНСКАЯ , волость Вологодского Наместничества и уезду. Здесь бывает два раза в год ярмарка , на коей торгуют Вологодские купцы мелочными товарами.",Вологодскаго Намѣстничества,Вологодскаго уѣздѣ,волость
195,338,147,"КРАСНОГОРСКАЯ, пустыня Тамбовского Наместничества в уезде города Лебедяни. Здесь при девичьем Пресбраженском монастыре бывает одна годовая ярмарка.",Тамбовскаго Намѣстничества,Лебедяни,пустыня
219,298,147,"КИАСОВКА , село Московской Губернии в Коломенском уезде. В нем по воскресеньям каждонедельно бывает торг, на коем продают хлеб и деревянную посуду.",Московской Губерніи,Коломенскомъ уѣздѣ,село
220,412,147,"МАСЛЕНСКАЯ, слобода Уфимского Наместничества в Челябинском уезде. Здесь бывает ярмарка Декабря 25 и Июля 20 дня ; торгуют на оных мелочным товаром.",Уфимскаго Намѣстничества,Челябинскомъ уѣздѣ,слобода
119,307,147,"КОДИНСКОЕ, село уфимского Наместничества в Челябинском уезде. В оном бывают ярмарки Июля 8 и Генваря 6, на коих торг производится мелочным товаром.",уфимскаго Намѣстничества,Челябинскомъ уѣздѣ,село
293,150,146,"ГЕРМАНОВА , слобода того же Наместничества в Пошехонском уезде. Здесь бывает годовая ярмарка в Никольскую пятницу осенью , и продолжается два дни.",Ярославскаго Намѣстничества,Пошехонскомъ уѣздѣ,слобода
289,489,145,"ОЛИШЕВКА , местечко в округе города Киева. Здесь бывает в году две ярмарки ; на оных скупают приезжие купцы кожи , овчины , шубы , соль и прочее.",,,мѣстечко
98,754,145,"ЧАСОВНЯ СВ. ДУХА , того же Наместничества и уезду. При оной бывает ярмарка в Июне месяце. Купцы приезжают из Пскова с разными мелочными товарами.",Псковскаго Намѣстничества,Псковскаго уѣздѣ,чацовня
25,457,145,"МШАГА, или МШАЖСКОЙ, погост Новогородского Наместничества и уезду. В оном бывает годовой съезд для торговли в пятницу пред днем Св. Пророка Илии.",Новогородскаго Намѣстничества,Новогородскаго уѣздѣ,погостъ
23,199,144,"ДУБЕЦКОЙ, погост Псковского Наместничества в Островском уезде. Здесь бывает ярмарка в Июне месяце; купцы приезжают из Пскова с разными товарами.",Псковскаго Намѣстничества,Островскомъ уѣздѣ,погостъ
283,469,144,"НЕСТЕРОВСКОЙ , шанец Екатеринославского Наместничествавоскресным дням, а торгуют больше крестьянскими товарами , хлебными и харчевыми припасами.",Екатеринославскаго Намѣстничества,,шанцъ
222,548,142,"ПОКРОВСКОЕ, село Московской Губернии в уезде города Рузы. В сем селе бывает годовая ярмарка Октября 1 дня; торгуют разными мелочными товарами.",Московской Губерніи,Рузы,село
110,266,140,"ИОСИФОВ, монастырь той же Губернии в Волоколамском уезде. Здесь бывают годовые ярмарки: первая в день Пятидесятницы , вторая Сентября 8 Дня.",Московской Губерніи,Волоколамскомъ уѣздѣ,монастырь
146,200,139,"ДУБКОВ, пригород того же Наместничества и уезду. Здесь бывают годовые ярмарки: 1 в Преображение Господне , 2 в день Сошествия Святого Духа.",Псковскаго Намѣстничества,Псковскаго уѣздѣ,пригородъ
190,665,139,"СТРЕЛИЦА, слобода Харьковского Наместничества в Короченском уезде. В оной бывает в году две ярмарки: первая Августа 1, вторая Марта 25 дня.",Харьковскаго Намѣстничества,Короченскомъ уѣздѣ,слобода
48,384,139,"ЛИСКОЙ , волок , что на Синге, в Вологодском уезде. Здесь бывает в году две ярмарки ; на оных торгуют Вологодские купцы мелочными товарами.",,Вологодскомъ уѣздѣ,волокъ
225,223,137,"ЕСКЕ, село Тверского Наместничества в Бежецком уезде. Здесь бывает годовая ярмарка; съезжаются на оную купцы с мелочным лавочным товаром.",Тверскаго Намѣстничества,Бѣжецкомъ уѣздѣ,село
171,56,135,"БОГОРОДИЦКОЙ КАЗАНСКОЙ , монастырь Пензенского Наместничества в Нижеломовском уезде. Бывает здесь годовая ярмаркаа с 1 Июля по 9 число.",Пензенскаго Намѣстничества,Нижеломовскомъ уѣздѣ,монастырь
180,424,133,"МЕХОНСКОЙ , острог Уфимского Наместничества в Челябинском уезде. Здесь бывает ярмарка Декабря 25 и Июля 20; торгуют мелочным товаром.",Уфимскаго Намѣстничества,Челябинскомъ уѣздѣ,острогъ
246,78,131,"БУРОМКА, местечко Киевского Наместничества в Лубенском уезде. В оном бывают в год две ярмарки: одна Июля 24, другая Ноября 1 числа.",Кіевскаго Намѣстничества,Лубенскомъ уѣздѣ,мѣстечко
