,0,1,2,3,4,5
126,411,286,"МАРКУШЕВСКАЯ , Економическая деревня Архангельского Наместничества. Здесь бывает ярмарка Июля 8 дня; купцы приезжают из ближних городов с разными мелочными москотильными и прочими товарами, и покупают у крестъян их приуготовления, а иногда и мягкую рухлядь, также сало , холст и прочее.",Архангельскаго Намѣстничества,,деревня
295,420,282,"МЕГРА, погост Олонецкого Наместничества в уезде города Вытегры. Здесь бывает годовая ярмарка в день Рождества Христова , торгуют лавочными на оной товарами, но большею частию мягкою рухлядью, для которой купцы приезжают из разных Российских городов , в том числе и из С. Петербурга.",Олонецкаго Намѣстничества,Вытегры,погостъ
45,368,280,"ЛАДИНСКОЙ, девичий монастырь Черниговского Наместничества в Прилуцком уезде. Здесь бывает 1 Октября в день Покрова Богородицы ярмарка, на которой жители окольных мест торгуют своими произрастениями, какъ-то хлебом, разным скотом, съестными припасами и прочею крестьянскою мелочью.",Черниговскаго Намѣстничества,Прилуцкомъ уѣздѣ,дѣвичій монастырь
132,88,279,"БЕЛОЗЕРСКОЙ КИРИЛОВ монастырь, того же Наместничества в Белозерском уезде. При оном бывают три годовые ярмарки: первая Июня 9, называемая Кириловская, вторая Августа 15, успенская, третия Ноября 21, Веденская; сюда приезжают из разных Российских городов купцы с разными товарами.",Новогородскаго Намѣстничества,Бѣлозерскомъ уѣздѣ,монастырь
90,702,278,"ТРОИЦКОЙ, монастырь Тамбовского Наместничества в Козловском уезде. При нем бывает в году две ярмарки: и) в день Сошествия Святого Духа, 2) в день Успения Богородицы. На оные приезжают купцы из Тамбова и Зарайска с шелковыми и другими мелкими товарами , и торгуют не более суток.",Тамбовскаго Намѣстничества,Козловскомъ уѣздѣ,монастырь
127,514,274,"ПАФНУТЬЕВ , монастырь Калужского Наместничества при городе Боровске. Подле сего монастыря бывают годовые ярмарки, первая о девятой пятнице, другая же Сентября 8 дня , в праздник Рождества Пресвятые Богородицы ; приезжают на оные купцы из разных городов с мелочными товарами.",Калужскаго Намѣстничества,,монастырь
124,500,271,"ОРЛОВ, слобода Воронежского Наместничества. Здесь бывает в году одна ярмарка, называемая Вознесенская , в Маие месяце; торг продолжается пять дней; приезжают купцы из окрестных городов, и торгуют разными шелковыми товарами , сукнами , а по большей части мелочными вещами.",Воронежскаго Намѣстничества,,слобода
121,460,269,"НАБДИН, погост Псковского Наместничества в Великолуцком уезде. Здесь бывает годовая ярмарка Декабря 25 дня, на коей от обывателей продаются кожи, лен, пенька, мед и прочия тому подобные вещи; а от Великолуцких, Торопецких Псковских купцов разные мелкие шелковые товары.",Псковскаго Намѣстничества,Великолуцкомъ уѣздѣ,погостъ
13,279,264,"КАРПОВКА, АРХАНГЕЛЬСКОЕ тожь, село Рязанского Наместничества в Донковском уезде. Здесь бывают в году две ярмарки: первая в день Архангела Михаила Ноября 8, вторая в день Чудотворца Николая , Декабря 6; приезжают сюда купцы и крестьяне с разными мелочными товарами.",Рязанскаго Намѣстничества,Донковскомъ уѣздѣ,село
6,322,264,"КОНСТАНТИНОВСКОЕ , село Тверского Наместничества в Кашинском уезде. Здесь бывает ярмарка Августа 15 дня; товары привозят из уезду холсты льняные разные, да из городов Ярославля, Переславля Залеского и Углича купцы приезжают с мелочными всякими небогатыми товарами.",Тверскаго Намѣстничества,Кашинскомъ уѣздѣ,село
39,202,263,"ДУБРОВКИ, село того же Наместничества в Темниковском уезде. Здесь бывает одна в году ярмарка, кроме еженедельных торгов, на седьмой неделе по Пасхе во вторник. Сюда приезжают купцы из окрестных городов с шелковыми и бумажными товарами, хлебом и прочими припасами.",Тамбовскаго Намѣстничества,Темниковскомъ уѣздѣ,село
84,301,261,"КЛЮЧЕВСКАЯ , пустыня Синбирского Наместничества в Алатырьском уезде. Здесь бывает в день Казанския Богородицы ярмарка, на которую приезжают со всякими шелковыми и прочими товарами из Москвы и из других городов купцы, такожь крестьяне со своими приуготовлениями.",Синбирскаго Намѣстничества,Алатырьскомъ уѣздѣ,пустыня
170,23,256,"АРХАНГЕЛЬСКОЕ, ЗМЕЕВКА тожь, село Рязанского Наместничества в Донковском уезде ; в оном бывают в году две ярмарки: первая Февраля 2 в день Сретения Господня , вторая Ноября 8, в день Архистратига Михаила. Сюда приезжают купцы с разными мелочными. товарами.",Рязанскаго Намѣстничества,Донковскомъ уѣздѣ,село
35,662,256,"СТАРЦОВ УГОЛ, или КОГУЕВА , пустыня Симбирского Наместничества в Алатырьском уезде. Здесь бывает ярмарка в день Преображения Господня ; на ту ярмарку приезжают со всякими шелковыми и прочими товарами из Москвы и из других городов купцы, такожь и крестьяне.",Симбирскаго Намѣстничества,Алатырьскомъ уѣздѣ,пустыня
71,677,254,"ТАРНЯНСКОЙ, городок Кокшайской четверти в уезде города Ваги. Бывает здесь годовая ярмарка, начинающаяся с 1 Генваря и продолжающаяся до 7 дня того же месяца. Купцы приезжают на оные из ближних городов с разными мелочными москотильными и прочими товарами.",,Ваги,городокъ
9,531,254,"ПЕТРОМА, село Ярославского Наместничества в Пошехонском уезде. В оном бывают две годовые ярмарки: первая Троицкая, вторая Ивановская , то есть 26 Сентября; приезжают на оные купцы из соседственных городов с разными шелковыми мелочными и прочими товарами.",Ярославскаго Намѣстничества,Пошехонскомъ уѣздѣ,село
80,478,254,"НУРОМСКОЙ , монастырь Вологодского Наместничества и уезду. Здесь бывает ярмарка Августа 1 числа, на которойпокупка и продажа происходишь разных мелочных москотильных и прочих крестьянами приуготовленных товаров, как - то сада, холста, мякотиных и прочих.",Вологодскаго Намѣстничества,Вологодскаго уѣздѣ,монастырь
243,339,253,"КРАСНОЕ , село Орловского Наместничества в Ливенском уезде. В оном бывает в году ярмарка 30 Июля. Сюда приезжают окрестных городов купцы и разночинцы с шелковыми товарами и другими , но по большей части мелочными , также и крестьяне со своими издельями.",Орловскаго Намѣстничества,Ливенскомъ уѣздѣ,село
144,7,252,"АКСЕЛЬ, село Тамбовского Наместничества в Темниковском уезде. Здесь бывает годовая ярмарка, сверх еженедельных торгов, в одинадцатую пятницу по Пасхе; купцы сюда приезжают из ближних городов с шелковыми и бумажными товарами, хлебом и прочими припасами.",Тамбовскаго Намѣстничества,Темниковскомъ уѣздѣ,село
308,763,252,"ЧЕРНАВСК, слобода Воронежского Наместничества. Здесь бывает одна в году ярмарка в день Сретения Иконы Владимирския Богородицы , то есть Июня 23 дня; на оную приезжают купцы из ближних городов с мелкими товарами, и продолжается оная только половину дня.",Воронежскаго Намѣстничества,,слобода
134,750,252,"ЦУРУХАТАЕВСКОЙ , форпост Иркутского Наместничества в Нерчинском уезде. Здесь бывает ярмарка в Июне и Июле месяцах ; торг происходит у Российского и Сибирского купечества с приезжающими Китайцами проме-ном Российских, а выменом разных Китайских товаров.",Иркутскаго Намѣстничества,Нерчинскомъ уѣздѣ,форпостъ
275,611,246,"СВИРСКОЙ АЛЕКСАНДРОВСКОЙ , монастырь в Олонецком уезде. При оном бывает годовая ярмарка в день Сошествия Святого Духа, Августа 30. Сюда для торгу приезжают купцы из разных Российских городов с шелковыми , бумажными , гарусными и прочими товарами.",,Олонецкомъ уѣздѣ,монастырь
216,352,245,"КРИВЦО , село Ярославского Наместничества и уезду. Здесь бывает годовая Никольская ярмарка Декабря в 5 день; крестьяне привозят и продают свиное сало, масло коровье, гусей, кожи сырые и овчины; купецкие же люди ни с какими товарами не приезжают.",Ярославскаго Намѣстничества,Ярославскаго уѣздѣ,село
168,515,244,"ПЕНА, слобода в окольности городка Карпова. В оной бывают ярмарки после Рождества на Всеедной неделе в субботу, Июня 24 и Сентября 14, продолжающияся по одному дню. Купцы приезжают на оные из близ лежащих городов с лавочными мелочными товарами.",,,слобода
169,502,244,"ОСКИНО , село Воронежского Наместничества в Коротоякском уезде. Здесь на первойнадесять неделе по Пасхе в пятницу бывает ярмарка продают шелковые и бумажные товары малым чмелом; и по большей части съезжаются крестьяне с их товарами и издельями.",Воронежскаго Намѣстничества,Коротоякскомъ уѣздѣ,село
104,529,244,"ПЕТРОВСКАЯ, слобода Вологодского Наместничества и уезду. Здесь бывает одна в году ярмарка в Июне месяце на Рождество Иоанна Предтечи. Сюда приезжают купцы Вологодские, Устюжские и Тотемские для покупки холстов и продажи разных мелочных товаров.",Вологодскаго Намѣстничества,Вологодскаго уѣздѣ,слобода
305,252,243,"ИГРИЩИ , село Ярославского Наместничества и уезду. В сем селе бывает годовая ярмарка в Сентябре месяце ; съезжаются купцы из ближних городов, как - то Ярославля, Ростова , Романова , Углича , Борисоглебска , Рыбного , Мологи и слободы Норской.",Ярославскаго Намѣстничества,Ярославскаго уѣздѣ,село
113,80,243,"БУШНРВО , село Костромского Наместничества около Парфентьевой слободы. В сем селе бывает в году две ярмарки : первая по Пасхе на десятой неделе, вторая Июля 8 числа; на оные приезжают купцы из близ лежащих городов с разными мелочными товарами.",Костромскаго Намѣстничества,,село
245,18,239,"АПИЧЕРСКАЯ, пустыня Синбирского Наместничества в Алатырьском уезде; здесь бывает ярмарка в день Каванския Богородицы. На сию ярмарку приезжают со всякими шелковыми и прочими товарами из Москвы и из других городов купцы, такожь и крестьяне.",Синбирскаго Намѣстничества,Алатырьскомъ уѣздѣ,пустыня
266,585,239,"РОПСК , местечко Новогородского - Северского Наместничества в Стародубовском уезде. В оном бывает в год три ярмарки, на которые съезжаются из окольных мест купцы с красными и другими мелочными товарами , также бывают и еженедельные торжки.",Новогородскаго - Сѣверскаго Намѣстничества,Стародубовскомъ уѣздѣ,мѣстечко
150,299,238,"КИАТА, село Казанского Наместничества в Свиажском уезде. В оном бывает в каждый год ярмарка в Июне месяце дней по пяти. Сюда приезжают разных городов Российские купцы с Российскими и иностранными товарами, также меняют и покупают лошадей.",Казанскаго Намѣстничества,Свіажскомъ уѣздѣ,село
262,132,237,"ВЫСОКОЕ, село Тверского Наместничества в Кашинском уезде. В оном бывает ярмарка Сентября 8 дня, на которую привозят из уезду холсты льняные разные, да из городов Ярославля , Переславля Залеского и Углича мелочные всякие небогатые товары.",Тверскаго Намѣстничества,Кашинскомъ уѣздѣ,село
304,795,237,"ЯЗЫКОВО, село Синбирского Наместничества в Курмышском уезде. Бывает здесь ярмарка в день Происхождения Честных Древ; на ту ярмарку приезжают со всякими шелковыми и прочими товарами из Москвы и из других городов купцы , также и крестьяне.",Синбирскаго Намѣстничества,Курмышскомъ уѣздѣ,село
122,546,236,"ПОКРОВСКОЕ, Економическое село Казанского Наместничества в уезде города Козьмодемьянска. Здесь бывает одна в году ярмарка, которая продолжается не более четырех дней , и на которой торгуют разными шелковыми и прочими мелочными товарами.",Казанскаго Намѣстничества,Козьмодемьянска,Економическое село
142,730,232,"ФЛОРИЩЕВА, пустыня Володимерского Наместничества в Гороховецком уезде. Здесь бывает ярмарка прежде праздника Успения Пресвятые Богородицы дней за пять, на которую привозят холст и прочие мелочные Российские товары, также и шелковые.",Володимерскаго Намѣстничества,Гороховецком уѣздѣ,пустыня
91,708,227,"ТУРКИ , село Пензенского Наместничества в уезде города Керенска. Здесь бываетв году ярмарка в Июле месяце , на которую приезжают из ближних городов с разными мелочными товарами; торгуют также лошадьми , рогатым скотом и прочим.",Пензенскаго Намѣстничества,Керенска,село
237,222,223,"ЕРЕМЕЕВКА, местечко Киевского Наместничества в Лубенском уезде. Здесь бывает в год четыре ярмарки : первая в день Преполовения Господня , вторая в день Петра и Павла, третия в день Св. Димитрия, четвертая о всеедной неделе.",Кіевскаго Намѣстничества,Лубенскомъ уѣздѣ,мѣстечко
204,403,221,"МАКАРОВО , село того же Наместничества в Керенском уезде. Здесь бывает ярмарка в году в Июле месяце; на оную купцы приезжают из блИз лежащих городов с мелочными товарами ; торгуют также лошадьми , рогатым скотом и прочим.",Пензенскаго Намѣстничества,Керенскомъ уѣздѣ,село
76,631,220,"СИМЕОНОВКА , местечко Новогородского - Северского Наместничества. В оном бывает в год три ярмарки, на которые съезжаются из окольных мест купцы с красныни и другими мелочными товарами; также бывают и еженедельные торжки.",Новогородскаго - Сѣверскаго Намѣстничества,,мѣстечко
280,684,220,"ТЕРЕШКОВО, село Тверского Наместничества в Зубцовском уезде. В нем бывает годовая ярмарка Мая 20, в день Алексея Митрополита; на оную приезжают купцы из окрестных ближних городов с мелочными шелковыми и прочими товарами.",Тверскаго Намѣстничества,Зубцовскомъ уѣздѣ,село
202,249,220,"ИВАНОВСКОЕ, село Калужского Наместничества близ города Малого Ярославца. Здесь бывает годовая ярмарка Июня 24 дня, на которую собираются купцы из Малого Ярославца и из Боровскаа, торгуют мелочными крестьянскими товарами.",Калужскаго Намѣстничества,,село
200,706,219,"ТУРЕЦКАЯ треть, или волость Вологодского Наместничества в уезде города Яренска. Здесь бывает ярмарка Февраля с 15 дня по Марте месяц; скупают здесь купцы по большей части заготовленную и свезенную сюда крестьянами рыбу.",Вологодскаго Намѣстничества,Яренска,треть
163,232,215,"ЗАРУБИНО, село Иркутского Наместничества в уезде города Киренска. Ярмарка бывает здесь в Июне месяце; купцы приезжают из ближних городов с разными мелочными товарами; торгуют также лошадьми, рогатым скотом и прочим.",Иркутскаго Намѣстничества,Киренска,село
88,395,213,"ЛЕВЫЕ ЛАМКИ, село Тамбовского Наместничества в уезде города Козлова. Здесь бывает одна годовая ярмарка Июля 8, в день праздника Казанския Богородицы. На оную приезжают окрестные купцы с разными мелочными товарами.",Тамбовскаго Намѣстничества,Козлова,село
22,753,212,"ЧАСОВНЯ АПОСТОЛА ФОМЫ, принадлежащая к Дворцовым волостям Псковского Наместничества в уезде города Острова. При оной бывает ярмарка в Апреле месяце ; купцы приезжают из близ лежащих городов с недорогими товарами.",Псковскаго Намѣстничества,Острова,чацовня
194,374,211,"ЛАПСТРАНД , кирка Выборгского Наместничества и уезду. Здесь бывает ярмарка осенью в Сентябре месяце ; на оную приезжают Нейшлотского и Выборгского уездов из кирок Чухны с смолою , с маслом, с салом и с скотиною.",Выборгскаго Намѣстничества,Выборгскаго уѣздѣ,кирка
273,120,211,"ВОЛЧЬЯ , слобода Харьковского Наместничества и уезду. Здесь бывают ярмарки Сентября 6, Октября 14, Декабря 9, Генваря 27, Марта 9, Мая 11, Июля 24; торгуют купцы мелочными товарами, вином, пивом, медом и прочим.",Харьковскаго Намѣстничества,Харьковскаго уѣздѣ,слобода
